{"SchemaVersion":1,"ArtifactKind":"runner-approval-event","ApprovedCommit":"aaaaaaaaaaaaaaaaaaaaaaaaaaaaaaaaaaaaaaaa","ToolchainPolicyHash":"bbbbbbbbbbbbbbbbbbbbbbbbbbbbbbbbbbbbbbbbbbbbbbbbbbbbbbbbbbbbbbbb","RunnerTreeHash":"cccccccccccccccccccccccccccccccccccccccccccccccccccccccccccccccc","ValidatorIdentityHash":"dddddddddddddddddddddddddddddddddddddddddddddddddddddddddddddddd","ScannerIdentityHash":"eeeeeeeeeeeeeeeeeeeeeeeeeeeeeeeeeeeeeeeeeeeeeeeeeeeeeeeeeeeeeeee","ToolCacheRoot":"C:\\tool-cache","GitCommonDirHash":"ffffffffffffffffffffffffffffffffffffffffffffffffffffffffffffffff","WorktreeNamespace":"1111111111111111111111111111111111111111111111111111111111111111","PointerGeneration":1}
